{
  "schema_version": "1.0.0",
  "checkpoint_id": "CHK-BIZTRUST-GUIDE-WP-077-001",
  "created_at": "2026-09-06T08:30:28Z",
  "work_package_id": "BIZTRUST-GUIDE-WP-077",
  "state": "ENGINEERING_READY",
  "objective": "Resolve ticket #140 on the P0 design map under the pack's template and the map's charting decision 8: write the P0.6 design with its nine mandatory sections, the tenant-owned record baseline as a table template, the tenancy schema with two synthetic tenants, the transaction-scoped tenant key, the ownership split with each role's attributes, the enablement rule, the expand-first migration convention, naming, eight ownership tests as catalogue queries, eight negative controls, the evidence contract, candidates pending ADR-004, ADR-001 and ADR-015 with the RLS and bitemporal research cited by commit, eight open questions with ASSUMED positions, and a two-package cut; link it from the P0 manual's row.",
  "source": {
    "repository": "bstBizEra/biztrust_guide",
    "branch": "docs/biztrust-guide-wp-077-p0-06-tenancy-design",
    "baseline_commit": "40aa561dae790d3df484bf558c98b10b7b18628f"
  },
  "completed": [
    "Ticket #140 resolved by this branch: docs/architecture/p0/P0.06-tenancy-data-model.md at PROPOSED with the template's nine sections.",
    "The P0 manual's P0.6 row links the design on GitHub; the design pack test holds the file to the template.",
    "badf/ re-anchored: NS-043 records the frontier with P0.3 next in the manual's order, DEC-079 appended, this checkpoint written."
  ],
  "remaining": [
    "Two-axis code review of the head commit, then merge, as for WP-059 to WP-076.",
    "After merge: #140 closed with a resolution comment; the map's decision line appended to #128.",
    "Map #128: #138 P0.3 next in the manual's order, then #139 P0.4 and #141 P0.7."
  ],
  "files_changed": [
    "docs/architecture/p0/P0.06-tenancy-data-model.md",
    "phases/p0.html",
    "badf/current-state.json",
    "badf/next-actions.json",
    "badf/decision-log.jsonl",
    "sessions/checkpoints/BIZTRUST-GUIDE-WP-077-engineering-ready.json"
  ],
  "validation": [
    {
      "command": "python3 -m unittest discover -s tests",
      "status": "PASS",
      "exit_code": 0
    },
    {
      "command": "python3 scripts/validate_continuity.py",
      "status": "PASS",
      "exit_code": 0
    }
  ],
  "observations": [
    "The RLS research reads PostgreSQL 18's documentation; the design cites it by finding number and quotes what the research quotes, and cites PostgreSQL's own pages, checked 2026-09-06, for the role attributes, privileges, catalogue flags and configuration functions the research does not carry.",
    "The pooler and its mode are the one thing the design cannot assume: the documentation is silent, so control 4 is a measurement and P0.6-B exists for it.",
    "The manual's execution order puts P0.3 before P0.6; the design pack's order of landing does not change the manual's order of building."
  ],
  "decisions": [
    "DEC-079: the P0.6 design at PROPOSED; the baseline as a template; the three exemptions closed and tables forced; a transaction-scoped key; expand-first migrations; eight ownership tests."
  ],
  "assumptions": [
    "The map's charting decision 8 permits the design to proceed with ADR-004 DRAFT_REQUIRED; the operator may reverse it by comment on #128.",
    "The design's eight ASSUMED positions are the track's; each names the decision that would reverse it."
  ],
  "blockers": [
    {
      "code": "OPERATOR_WAIVER_ON_ISSUE_27",
      "owner_role": "human-reviewer",
      "resolution": "Unchanged; gates the ADR tickets each design names as dependencies."
    },
    {
      "code": "SECRETS_STORE_ADR_ROW_MISSING",
      "owner_role": "accountable-architecture-owner",
      "resolution": "Unchanged; on map #128's Not yet specified."
    },
    {
      "code": "ROADMAP_SOURCE_DOCUMENTS_ISSUE_154",
      "owner_role": "human-reviewer",
      "resolution": "Unchanged."
    },
    {
      "code": "S01_BROKER_ANSWERS_AND_REVIEW_SEATS",
      "owner_role": "human-reviewer",
      "resolution": "Unchanged; #93 and #94. The design's legal-entity fixtures are invented until S01 answers."
    },
    {
      "code": "OPERATOR_LINE_ON_ISSUE_52",
      "owner_role": "human-reviewer",
      "resolution": "Unchanged."
    },
    {
      "code": "CONTENT_DECISIONS_ISSUES_78_81",
      "owner_role": "human-reviewer",
      "resolution": "Unchanged."
    },
    {
      "code": "REPOSITORY_OWNER_ACTIONS_NS_003_004_005",
      "owner_role": "repository-administrator",
      "resolution": "Unchanged."
    },
    {
      "code": "INDEPENDENT_ORACLE_AUTHOR_REQUIRED",
      "owner_role": "human-reviewer",
      "resolution": "Unchanged."
    }
  ],
  "authority": {
    "documentation_implementation": "GRANTED_BY_USER_REQUEST_2026_09_03",
    "p0_design_pack_drafting": "OPERATOR_INSTRUCTION_2026_09_05_PROCEED_ON_YOUR_CALL_PROPOSED_ONLY",
    "p0_designs_ahead_of_adr_tickets": "MAP_128_CHARTING_DECISION_8_2026_09_06_AGENT_RECOMMENDATION_REVERSIBLE_BY_OPERATOR",
    "repository_publish": "GRANTED_VIA_PULL_REQUEST",
    "merge": "AFTER_FRESH_CONTEXT_REVIEW_AS_FOR_WP_029_TO_076",
    "architecture_drafting_ahead_of_s01": "WAIT_FOR_OPERATOR_WAIVER_ISSUE_92",
    "design_acceptance": "ARCHITECTURE_AUTHORITY_AFTER_BT_G0_AND_ITS_ADRS",
    "gate_recording": "HUMAN_ONLY_PER_GATE_OWNER",
    "plan_acceptance": "NOT_GRANTED_UNTIL_BT_G0",
    "p0_implementation": "NOT_GRANTED_UNTIL_BT_G0",
    "architecture_acceptance": "NOT_GRANTED",
    "production_platform_implementation": "NOT_GRANTED",
    "experiment_rerun": "NOT_GRANTED"
  },
  "next_action_id": "NS-041",
  "recovery": {
    "first_safe_command": "python3 -m unittest discover -s tests -p test_p0_design_pack.py",
    "read_first": [
      "AGENTS.md",
      "badf/current-state.json",
      "badf/next-actions.json",
      "docs/architecture/p0/README.md",
      "https://github.com/bstBizEra/biztrust_guide/issues/128"
    ],
    "stop_if": [
      "A design names a technology as chosen, marks itself ACCEPTED, or says a capability is implemented, secure or compliant.",
      "A real client, policy, claim or premium datum, or a real legal entity's registration, appears in a design.",
      "Another session's worktree or uncommitted edit is touched."
    ]
  },
  "declared_non_coverage": [
    "No schema was created and no query was run; the design describes them and the controls that would prove them.",
    "The pooler and its mode are unmeasured; control 4 and P0.6-B exist for that.",
    "The design pack test checks structure and vocabulary, not the substance of any section."
  ]
}
